{
  "$schema": "schemas/performance-v1.schema.json",
  "id": "tbench-ai-official-full-roster-2026-09-22",
  "schema_version": 1,
  "kind": "performance",
  "provider": "other",
  "retrieved_at": "2026-09-22",
  "source_urls": [
    "https://www.tbench.ai/leaderboard/terminal-bench/4.0"
  ],
  "source_ids": [
    "tbench-ai-official-full-roster-2026-09-22"
  ],
  "notes": "FULL SAME-SNAPSHOT roster pass (2026-09-22) of the OFFICIAL Terminal-Bench leaderboard (www.tbench.ai/leaderboard/terminal-bench/4.0, 308-redirects to tbench.ai root and renders the table client-side), rendered via headless browser (grab.py technique). This is a FULLER read than performance/gpt-6-sol-luna-board-coverage-2026-09-22.json's tbench.ai row, which only recorded a claim of gpt-6-sol/gpt-6-luna absence with a single Astra data point quoted in prose and no scored table — this file has the complete 15-row scored table (accuracy with 95% CI, harness, launch date, total run tokens, total run cost) parsed from the rendered HTML table markup directly (not a chart digitization). IMPORTANT UNIT NOTE: the 'tokens' and 'cost' columns on this board are TOTAL COST/TOKENS FOR THE FULL BENCHMARK RUN across all tasks and repeats, NOT per-task figures — a different unit from every AA/vals.ai row in this pack, which report per-task cost. Recorded using cost.unit='other' per this pack's convention for non-per-task costs (same convention as ARC-AGI-3's per-suite cost rows). Distinct comparability_group from every other terminal-bench-4-0 reading in this pack (AA's own harness, vals.ai's secondary reading, and now this official board each disagree numerically and must not be cross-ranked despite sharing metric_id terminal-bench-4-0). Gpt-6-astra's row here (58.2%±2.8%, Codex harness, Sep 3 2026, 1.5B tokens, $3.3k) is a re-observation of the SAME board already read on this date by gpt-6-sol-luna-board-coverage-2026-09-22.json's claim (which only quoted this Astra figure as a control point, without recording it as a scored row) — recorded here as this pack's first full score row for it.",
  "claims": [
    {
      "models": ["claude-opus-5-5", "claude-haiku-4-5", "gpt-6-sol", "gpt-6-luna"],
      "task_families": ["coding"],
      "axes": ["quality"],
      "statement": "CONFIRMED ABSENT from the official tbench.ai Terminal-Bench 4.0 leaderboard (all 15 ranked rows checked): claude-opus-5-5, claude-haiku-4-5, gpt-6-sol, gpt-6-luna. gpt-6-astra (rank 1) and claude-fable-5-1 (rank 2) are both present on the same board as controls, both launched within the last 3 weeks — this rules out a blanket 'too new to be ingested' explanation and points to a genuine per-model gap for these four specifically.",
      "source_id": "tbench-ai-official-full-roster-2026-09-22"
    }
  ],
  "scores": [
    {
      "model": "gpt-6-astra",
      "metric": "Terminal-Bench 4.0",
      "score": 0.582,
      "unit": "accuracy",
      "effort": "max",
      "harness": "codex",
      "source_id": "tbench-ai-official-full-roster-2026-09-22",
      "caveat": "Rank 1 of 15. 95% CI ±2.8pp. Launch-date column shows Sep 3, 2026 (this model's own launch date, not the read date). Total run: 1.5B tokens, $3.3k total cost (NOT per-task — see file notes).",
      "source_type": "third_party_board",
      "evidence_grade": "B",
      "observed_at": "2026-09-22",
      "effort_verbatim": "max",
      "task_family": "coding",
      "metric_id": "terminal-bench-4-0",
      "comparable": false,
      "comparability_group": "terminal-bench-4-0-tbench-ai-official-2026-09-22",
      "cost": { "value": 3300, "unit": "other", "basis": "api_usd" }
    },
    {
      "model": "claude-fable-5-1",
      "metric": "Terminal-Bench 4.0",
      "score": 0.579,
      "unit": "accuracy",
      "effort": "max",
      "harness": "claude-code",
      "source_id": "tbench-ai-official-full-roster-2026-09-22",
      "caveat": "Rank 2 of 15. 95% CI ±3.8pp. Launch-date column shows Sep 1, 2026. Total run: 2.7B tokens, $6.2k total cost.",
      "source_type": "third_party_board",
      "evidence_grade": "B",
      "observed_at": "2026-09-22",
      "effort_verbatim": "max",
      "task_family": "coding",
      "metric_id": "terminal-bench-4-0",
      "comparable": false,
      "comparability_group": "terminal-bench-4-0-tbench-ai-official-2026-09-22",
      "cost": { "value": 6200, "unit": "other", "basis": "api_usd" }
    },
    {
      "model": "gpt-5.6-sol",
      "metric": "Terminal-Bench 4.0",
      "score": 0.373,
      "unit": "accuracy",
      "effort": "max",
      "harness": "codex",
      "source_id": "tbench-ai-official-full-roster-2026-09-22",
      "caveat": "Rank 7 of 15. 95% CI ±3.8pp. Launch-date column shows Jun 26, 2026. Total run: 4.4B tokens, $2.5k total cost.",
      "source_type": "third_party_board",
      "evidence_grade": "B",
      "observed_at": "2026-09-22",
      "effort_verbatim": "max",
      "task_family": "coding",
      "metric_id": "terminal-bench-4-0",
      "comparable": false,
      "comparability_group": "terminal-bench-4-0-tbench-ai-official-2026-09-22",
      "cost": { "value": 2500, "unit": "other", "basis": "api_usd" }
    },
    {
      "model": "gpt-5.6-terra",
      "metric": "Terminal-Bench 4.0",
      "score": 0.215,
      "unit": "accuracy",
      "effort": "max",
      "harness": "codex",
      "source_id": "tbench-ai-official-full-roster-2026-09-22",
      "caveat": "Rank 9 of 15. 95% CI ±3.3pp. Launch-date column shows Jun 26, 2026. Total run: 5.7B tokens, $1.7k total cost.",
      "source_type": "third_party_board",
      "evidence_grade": "B",
      "observed_at": "2026-09-22",
      "effort_verbatim": "max",
      "task_family": "coding",
      "metric_id": "terminal-bench-4-0",
      "comparable": false,
      "comparability_group": "terminal-bench-4-0-tbench-ai-official-2026-09-22",
      "cost": { "value": 1700, "unit": "other", "basis": "api_usd" }
    },
    {
      "model": "grok-4.6",
      "metric": "Terminal-Bench 4.0",
      "score": 0.203,
      "unit": "accuracy",
      "effort": "high",
      "harness": "grok-build",
      "source_id": "tbench-ai-official-full-roster-2026-09-22",
      "caveat": "Rank 10 of 15. 95% CI ±3.1pp. Launch-date column shows Aug 12, 2026. Total run: 4.0B tokens, $3.6k total cost.",
      "source_type": "third_party_board",
      "evidence_grade": "B",
      "observed_at": "2026-09-22",
      "effort_verbatim": "high",
      "task_family": "coding",
      "metric_id": "terminal-bench-4-0",
      "comparable": false,
      "comparability_group": "terminal-bench-4-0-tbench-ai-official-2026-09-22",
      "cost": { "value": 3600, "unit": "other", "basis": "api_usd" }
    },
    {
      "model": "gpt-5.6-luna",
      "metric": "Terminal-Bench 4.0",
      "score": 0.173,
      "unit": "accuracy",
      "effort": "max",
      "harness": "codex",
      "source_id": "tbench-ai-official-full-roster-2026-09-22",
      "caveat": "Rank 12 of 15. 95% CI ±2.8pp. Launch-date column shows Jun 26, 2026. Total run: 11.6B tokens, $0.3k total cost.",
      "source_type": "third_party_board",
      "evidence_grade": "B",
      "observed_at": "2026-09-22",
      "effort_verbatim": "max",
      "task_family": "coding",
      "metric_id": "terminal-bench-4-0",
      "comparable": false,
      "comparability_group": "terminal-bench-4-0-tbench-ai-official-2026-09-22",
      "cost": { "value": 300, "unit": "other", "basis": "api_usd" }
    },
    {
      "model": "claude-sonnet-5",
      "metric": "Terminal-Bench 4.0",
      "score": 0.124,
      "unit": "accuracy",
      "effort": "max",
      "harness": "claude-code",
      "source_id": "tbench-ai-official-full-roster-2026-09-22",
      "caveat": "Rank 13 of 15 (tied with Grok 4.5). 95% CI ±3.1pp. Launch-date column shows Jun 30, 2026. Total run: 21.6B tokens, $9.6k total cost — by far the highest total-run token/cost figure of any candidate on this board, consistent with claude-sonnet-5's unusually high accuracy-to-cost ratio problems already flagged on the vals.ai secondary board (performance/terminal-bench-4-vals-opus-5-5-2026-09.json). First recording of claude-sonnet-5 on the official tbench.ai board in this pack.",
      "source_type": "third_party_board",
      "evidence_grade": "B",
      "observed_at": "2026-09-22",
      "effort_verbatim": "max",
      "task_family": "coding",
      "metric_id": "terminal-bench-4-0",
      "comparable": false,
      "comparability_group": "terminal-bench-4-0-tbench-ai-official-2026-09-22",
      "cost": { "value": 9600, "unit": "other", "basis": "api_usd" }
    }
  ],
  "missing": [
    "claude-opus-5-5, claude-haiku-4-5, gpt-6-sol, gpt-6-luna on the official tbench.ai board — CONFIRMED ABSENT, all 15 ranked rows checked by name.",
    "Per-category or per-task breakdown — this board only publishes a single overall accuracy figure per model row, no sub-scores.",
    "Effort variants below 'max'/'high' for any candidate — the official board shows exactly one row per model (its best/default effort), unlike ARC Prize's full effort ladders."
  ]
}
